0-3516652-138051,"Number of dependets, then years then percentage of rejection ",Percentage of rejection ,0,0,0,0,0,0,0,1,reject_chance,3516652
0-11034831-138051,Rejection percentage 1st,If rejection percentage is the same then I look at life/years gained from the transplant,0,1,0,0,0,0,0,1,"life, reject_chance",11034831
0-11052140-138051,Life expectancy and percentage chance,The patient who seemed in better health by alcoholic drinks and size,0,1,0,0,1,0,0,1,"life, alco, reject_chance",11052140
0-4035470-138051,The amount of years gained and rejection estimation first.,How much they drank and violent crimes to determine if they would take care of their body.,0,1,0,0,0,0,1,1,"life, crim, reject_chance",4035470
0-4254843-138051,"I looked at 2 main things: life expectancy, percentage chance","I looked at percentage chance, alcohol drinking, sometimes dependents.",1,1,0,0,1,0,0,1,"dep, life, alco, reject_chance",4254843
0-5017701-138051,"I tried to balance different factors such as years on the wait list, years gained, number of dependents, etc.",I considered the number of years gained and the number of children.,1,1,1,0,0,0,0,0,"dep, life, years_waiting",5017701
0-4221331-138051,Time on list > years gained > number of children,One that could work stress free,1,1,1,0,0,1,0,0,"dep, life, years_waiting, work_hours",4221331
